{
  "$schema": "https://json-schema.org/draft/2020-12/schema",
  "$id": "https://practical-game-studio.dev/schemas/critical-path.schema.json",
  "title": "PGS Dependency-Aware Milestone Critical Path",
  "type": "object",
  "additionalProperties": false,
  "required": [
    "schema_version",
    "current_milestone",
    "current_milestone_id",
    "milestone_override",
    "configured_max_items",
    "items",
    "history",
    "recommended_next_id",
    "pinned_sources",
    "excluded_sources",
    "exclusion_reasons",
    "non_critical_work",
    "exit_condition",
    "calculated_at",
    "calculation_snapshot",
    "freshness",
    "warnings"
  ],
  "properties": {
    "schema_version": {"const": "3.1"},
    "current_milestone": {"type": "string", "minLength": 1},
    "current_milestone_id": {"type": ["string", "null"], "pattern": "^MS-[0-9]{4,}$"},
    "milestone_override": {"type": "boolean"},
    "configured_max_items": {"type": "integer", "minimum": 3, "maximum": 10},
    "items": {
      "type": "array",
      "items": {"$ref": "#/$defs/pathItem"}
    },
    "history": {
      "type": "array",
      "items": {"$ref": "#/$defs/pathItem"}
    },
    "recommended_next_id": {
      "type": ["string", "null"],
      "pattern": "^CP-[0-9]{4,}$"
    },
    "pinned_sources": {
      "type": "array",
      "items": {"$ref": "#/$defs/sourceKey"},
      "uniqueItems": true
    },
    "excluded_sources": {
      "type": "array",
      "items": {"$ref": "#/$defs/sourceKey"},
      "uniqueItems": true
    },
    "exclusion_reasons": {
      "type": "object",
      "propertyNames": {
        "pattern": "^(?:issue:ISS-[0-9]{3,}|decision:DEC-[0-9]{3,}|milestone:MC-[0-9]{3,}|verification:(?:ISS|DEC|MC)-[0-9]{3,}:[a-z0-9-]+|manual:[a-z0-9][a-z0-9-]*)$"
      },
      "additionalProperties": {"type": "string", "minLength": 1}
    },
    "non_critical_work": {
      "type": "array",
      "items": {"type": "string", "minLength": 1},
      "uniqueItems": true
    },
    "exit_condition": {"type": "string", "minLength": 1},
    "calculated_at": {
      "type": ["string", "null"],
      "format": "date-time"
    },
    "calculation_snapshot": {
      "oneOf": [
        {"type": "null"},
        {"$ref": "#/$defs/calculationSnapshot"}
      ]
    },
    "freshness": {
      "type": "object",
      "additionalProperties": false,
      "required": ["status", "reasons"],
      "properties": {
        "status": {"enum": ["current", "stale", "absent"]},
        "reasons": {
          "type": "array",
          "items": {"type": "string", "minLength": 1},
          "uniqueItems": true
        }
      }
    },
    "warnings": {
      "type": "array",
      "items": {"type": "string", "minLength": 1},
      "uniqueItems": true
    }
  },
  "$defs": {
    "sourceKey": {
      "type": "string",
      "pattern": "^(?:issue:ISS-[0-9]{3,}|decision:DEC-[0-9]{3,}|milestone:MC-[0-9]{3,}|verification:(?:ISS|DEC|MC)-[0-9]{3,}:[a-z0-9-]+|manual:[a-z0-9][a-z0-9-]*)$"
    },
    "pathItem": {
      "type": "object",
      "additionalProperties": false,
      "required": [
        "id",
        "type",
        "source_id",
        "source_key",
        "title",
        "description",
        "reason",
        "milestone_impact",
        "priority_tier",
        "dependencies",
        "dependency_origins",
        "status",
        "completion_condition",
        "recommended_action",
        "owner",
        "evidence_required",
        "pinned",
        "manual",
        "created_at",
        "updated_at",
        "source_status",
        "evidence_state"
      ],
      "properties": {
        "id": {"type": "string", "pattern": "^CP-[0-9]{4,}$"},
        "type": {
          "enum": [
            "issue",
            "decision",
            "verification",
            "milestone-criterion",
            "manual-action"
          ]
        },
        "source_id": {
          "type": ["string", "null"],
          "pattern": "^(?:ISS|DEC|MC)-[0-9]{3,}$"
        },
        "source_key": {"$ref": "#/$defs/sourceKey"},
        "title": {"type": "string", "minLength": 1},
        "description": {"type": "string", "minLength": 1},
        "reason": {"type": "string", "minLength": 1},
        "milestone_impact": {"type": "string", "minLength": 1},
        "priority_tier": {"type": "integer", "minimum": 1, "maximum": 5},
        "dependencies": {
          "type": "array",
          "items": {"type": "string", "pattern": "^CP-[0-9]{4,}$"},
          "uniqueItems": true
        },
        "dependency_origins": {
          "type": "array",
          "items": {
            "type": "object",
            "additionalProperties": false,
            "required": [
              "prerequisite_source_key",
              "origin",
              "dependency_id",
              "reason"
            ],
            "properties": {
              "prerequisite_source_key": {"$ref": "#/$defs/sourceKey"},
              "origin": {"enum": ["explicit", "derived"]},
              "dependency_id": {
                "type": ["string", "null"],
                "pattern": "^DEP-[0-9]{4,}$"
              },
              "reason": {"type": "string", "minLength": 1}
            }
          }
        },
        "status": {
          "enum": [
            "pending",
            "ready",
            "blocked",
            "in-progress",
            "completed",
            "removed"
          ]
        },
        "completion_condition": {"type": "string", "minLength": 1},
        "recommended_action": {"type": "string", "minLength": 1},
        "owner": {"type": "string", "minLength": 1},
        "evidence_required": {
          "type": "array",
          "items": {"type": "string", "minLength": 1},
          "uniqueItems": true
        },
        "pinned": {"type": "boolean"},
        "manual": {"type": "boolean"},
        "created_at": {"type": "string", "format": "date-time"},
        "updated_at": {"type": "string", "format": "date-time"},
        "source_status": {"type": "string", "minLength": 1},
        "evidence_state": {"type": "string", "minLength": 1}
      }
    },
    "calculationSnapshot": {
      "type": "object",
      "additionalProperties": false,
      "required": [
        "milestone",
        "candidates",
        "criterion_definitions_fingerprint",
        "criterion_evaluations_fingerprint",
        "criterion_evidence_lifecycle_fingerprint",
        "dependency_graph_fingerprint",
        "evidence_sources",
        "evidence_fingerprint",
        "manual_controls_fingerprint"
      ],
      "properties": {
        "milestone": {"type": "string", "minLength": 1},
        "candidates": {
          "type": "object",
          "propertyNames": {
            "pattern": "^(?:issue:ISS-[0-9]{3,}|decision:DEC-[0-9]{3,}|milestone:MC-[0-9]{3,}|verification:(?:ISS|DEC|MC)-[0-9]{3,}:[a-z0-9-]+|manual:[a-z0-9][a-z0-9-]*)$"
          },
          "additionalProperties": {
            "type": "object",
            "additionalProperties": false,
            "required": [
              "fingerprint",
              "priority_tier",
              "source_status",
              "evidence_state"
            ],
            "properties": {
              "fingerprint": {"type": "string", "pattern": "^[a-f0-9]{64}$"},
              "priority_tier": {"type": "integer", "minimum": 1, "maximum": 5},
              "source_status": {"type": "string", "minLength": 1},
              "evidence_state": {"type": "string", "minLength": 1}
            }
          }
        },
        "criterion_definitions_fingerprint": {
          "type": "string",
          "pattern": "^[a-f0-9]{64}$"
        },
        "criterion_evaluations_fingerprint": {
          "type": "string",
          "pattern": "^[a-f0-9]{64}$"
        },
        "criterion_evidence_lifecycle_fingerprint": {
          "type": "string",
          "pattern": "^[a-f0-9]{64}$"
        },
        "dependency_graph_fingerprint": {
          "type": "string",
          "pattern": "^[a-f0-9]{64}$"
        },
        "evidence_fingerprint": {
          "type": "string",
          "pattern": "^[a-f0-9]{64}$"
        },
        "evidence_sources": {
          "type": "array",
          "items": {"type": "string", "pattern": "^EVD-[0-9]{3,}$"},
          "uniqueItems": true
        },
        "manual_controls_fingerprint": {
          "type": "string",
          "pattern": "^[a-f0-9]{64}$"
        }
      }
    }
  }
}
